{
  "protocolVersion": {
    "major": 0,
    "minor": 1
  },
  "snapshotId": "fixture-android-profile",
  "sessionId": "fixture-session-android",
  "capturedAt": "2026-10-18T03:00:00Z",
  "source": "fixture",
  "target": {
    "platform": "android",
    "deviceId": "example-android",
    "deviceName": "Pixel · 示例设备",
    "appId": "com.viewin.example",
    "appName": "Viewin Sample",
    "appVersion": "0.1",
    "osVersion": "示例",
    "buildType": "internalRelease",
    "frameworks": [
      {
        "name": "androidView"
      },
      {
        "name": "compose"
      }
    ]
  },
  "capabilities": [
    {
      "name": "hierarchy",
      "status": "available"
    },
    {
      "name": "geometry",
      "status": "available"
    },
    {
      "name": "screenshot",
      "status": "unavailable",
      "reason": "fixture_has_no_image"
    },
    {
      "name": "liveConnection",
      "status": "unavailable",
      "reason": "offline_fixture"
    }
  ],
  "capture": {
    "startedAt": "2026-10-18T03:00:00Z",
    "completedAt": "2026-10-18T03:00:00Z",
    "completeness": "partial",
    "consistency": "stable",
    "warnings": [
      {
        "code": "fixture_data",
        "message": "手工构造的协议示例；不代表真实设备采集或 Release 兼容性。"
      }
    ]
  },
  "windows": [
    {
      "id": "main",
      "title": "Main Window",
      "size": {
        "width": 390,
        "height": 844
      },
      "unit": "dp",
      "pixelsPerUnit": 3,
      "rootNodeIds": [
        "window"
      ]
    }
  ],
  "nodes": [
    {
      "id": "window",
      "windowId": "main",
      "parentId": null,
      "childIds": [
        "root"
      ],
      "framework": "androidView",
      "kind": "window",
      "typeName": "DecorView",
      "name": "DecorView",
      "identifiers": {},
      "geometry": {
        "localBounds": {
          "x": 0,
          "y": 0,
          "width": 390,
          "height": 844
        },
        "frameInWindow": {
          "x": 0,
          "y": 0,
          "width": 390,
          "height": 844
        },
        "cornersInWindow": [
          {
            "x": 0,
            "y": 0
          },
          {
            "x": 390,
            "y": 0
          },
          {
            "x": 390,
            "y": 844
          },
          {
            "x": 0,
            "y": 844
          }
        ],
        "clipInWindow": [
          {
            "x": 0,
            "y": 0
          },
          {
            "x": 390,
            "y": 0
          },
          {
            "x": 390,
            "y": 844
          },
          {
            "x": 0,
            "y": 844
          }
        ]
      },
      "visibility": {
        "hidden": false,
        "alpha": 1
      },
      "properties": []
    },
    {
      "id": "root",
      "windowId": "main",
      "parentId": "window",
      "childIds": [
        "screen",
        "layer"
      ],
      "framework": "androidView",
      "kind": "view",
      "typeName": "ComposeView",
      "name": "ComposeView",
      "identifiers": {},
      "geometry": {
        "localBounds": {
          "x": 0,
          "y": 0,
          "width": 390,
          "height": 844
        },
        "frameInWindow": {
          "x": 0,
          "y": 0,
          "width": 390,
          "height": 844
        },
        "cornersInWindow": [
          {
            "x": 0,
            "y": 0
          },
          {
            "x": 390,
            "y": 0
          },
          {
            "x": 390,
            "y": 844
          },
          {
            "x": 0,
            "y": 844
          }
        ]
      },
      "visibility": {
        "hidden": false,
        "alpha": 1
      },
      "properties": []
    },
    {
      "id": "screen",
      "windowId": "main",
      "parentId": "root",
      "childIds": [
        "stack"
      ],
      "framework": "compose",
      "kind": "component",
      "typeName": "ProfileScreen",
      "name": "ProfileScreen",
      "identifiers": {},
      "geometry": null,
      "visibility": {
        "hidden": false,
        "alpha": 1
      },
      "properties": []
    },
    {
      "id": "stack",
      "windowId": "main",
      "parentId": "screen",
      "childIds": [
        "heading",
        "subtitle",
        "card",
        "button",
        "scroll"
      ],
      "framework": "compose",
      "kind": "stack",
      "typeName": "Column",
      "name": "Column",
      "identifiers": {},
      "geometry": {
        "localBounds": {
          "x": 0,
          "y": 0,
          "width": 342,
          "height": 660
        },
        "frameInWindow": {
          "x": 24,
          "y": 76,
          "width": 342,
          "height": 660
        },
        "cornersInWindow": [
          {
            "x": 24,
            "y": 76
          },
          {
            "x": 366,
            "y": 76
          },
          {
            "x": 366,
            "y": 736
          },
          {
            "x": 24,
            "y": 736
          }
        ]
      },
      "visibility": {
        "hidden": false,
        "alpha": 1
      },
      "properties": [
        {
          "id": "appearance",
          "title": "内容与样式",
          "properties": [
            {
              "id": "spacing",
              "title": "spacing",
              "value": 20,
              "availability": "available"
            }
          ]
        }
      ]
    },
    {
      "id": "heading",
      "windowId": "main",
      "parentId": "stack",
      "childIds": [],
      "framework": "compose",
      "kind": "text",
      "typeName": "Text",
      "name": "Text",
      "identifiers": {
        "testTag": "profile.title"
      },
      "geometry": {
        "localBounds": {
          "x": 0,
          "y": 0,
          "width": 342,
          "height": 42
        },
        "frameInWindow": {
          "x": 24,
          "y": 76,
          "width": 342,
          "height": 42
        },
        "cornersInWindow": [
          {
            "x": 24,
            "y": 76
          },
          {
            "x": 366,
            "y": 76
          },
          {
            "x": 366,
            "y": 118
          },
          {
            "x": 24,
            "y": 118
          }
        ]
      },
      "visibility": {
        "hidden": false,
        "alpha": 1
      },
      "properties": [
        {
          "id": "appearance",
          "title": "内容与样式",
          "properties": [
            {
              "id": "text",
              "title": "text",
              "value": "Hello, Viewin",
              "availability": "available"
            },
            {
              "id": "fontSize",
              "title": "fontSize",
              "value": 30,
              "availability": "available"
            },
            {
              "id": "fontWeight",
              "title": "fontWeight",
              "value": "semibold",
              "availability": "available"
            }
          ]
        }
      ]
    },
    {
      "id": "subtitle",
      "windowId": "main",
      "parentId": "stack",
      "childIds": [],
      "framework": "compose",
      "kind": "text",
      "typeName": "Text",
      "name": "Text",
      "identifiers": {},
      "geometry": {
        "localBounds": {
          "x": 0,
          "y": 0,
          "width": 342,
          "height": 26
        },
        "frameInWindow": {
          "x": 24,
          "y": 124,
          "width": 342,
          "height": 26
        },
        "cornersInWindow": [
          {
            "x": 24,
            "y": 124
          },
          {
            "x": 366,
            "y": 124
          },
          {
            "x": 366,
            "y": 150
          },
          {
            "x": 24,
            "y": 150
          }
        ]
      },
      "visibility": {
        "hidden": false,
        "alpha": 1
      },
      "properties": [
        {
          "id": "appearance",
          "title": "内容与样式",
          "properties": [
            {
              "id": "text",
              "title": "text",
              "value": "Inspect the details.",
              "availability": "available"
            },
            {
              "id": "fontSize",
              "title": "fontSize",
              "value": 15,
              "availability": "available"
            }
          ]
        }
      ]
    },
    {
      "id": "card",
      "windowId": "main",
      "parentId": "stack",
      "childIds": [
        "avatar",
        "name",
        "email"
      ],
      "framework": "compose",
      "kind": "view",
      "typeName": "ProfileCard",
      "name": "ProfileCard",
      "identifiers": {},
      "geometry": {
        "localBounds": {
          "x": 0,
          "y": 0,
          "width": 342,
          "height": 144
        },
        "frameInWindow": {
          "x": 24,
          "y": 182,
          "width": 342,
          "height": 144
        },
        "cornersInWindow": [
          {
            "x": 24,
            "y": 182
          },
          {
            "x": 366,
            "y": 182
          },
          {
            "x": 366,
            "y": 326
          },
          {
            "x": 24,
            "y": 326
          }
        ]
      },
      "visibility": {
        "hidden": false,
        "alpha": 1
      },
      "properties": [
        {
          "id": "appearance",
          "title": "内容与样式",
          "properties": [
            {
              "id": "cornerRadius",
              "title": "cornerRadius",
              "value": 20,
              "availability": "available"
            },
            {
              "id": "backgroundColor",
              "title": "backgroundColor",
              "value": "#EAF3FF",
              "availability": "available"
            }
          ]
        }
      ]
    },
    {
      "id": "avatar",
      "windowId": "main",
      "parentId": "card",
      "childIds": [],
      "framework": "compose",